[
  {
    "id": "58931b77-38bb-427d-be3e-e44fb9cf6dc2",
    "correo": "fernando.vega@utec.edu.pe",
    "contrasena": "hash_e55a53b7d0fa4815",
    "autorizacion": false
  },
  {
    "id": "1fcee0ab-e0a9-4c2b-bd3f-3cfe8eafa51d",
    "correo": "luis.rodriguez@outlook.com",
    "contrasena": "hash_790af59dc3d443f5",
    "autorizacion": false
  },
  {
    "id": "a0c06a21-57da-4577-b59d-97e94d2f20b8",
    "correo": "diego.morales@outlook.com",
    "contrasena": "hash_8d73735577474005",
    "autorizacion": false
  },
  {
    "id": "947d8506-9f0f-4f99-9c45-a49ad25a181d",
    "correo": "miguel.torres@outlook.com",
    "contrasena": "hash_131f6e7ff9b04a31",
    "autorizacion": false
  },
  {
    "id": "4a8ebe49-fca0-43fd-ba27-978ee6273ec8",
    "correo": "jose.gonzalez@outlook.com",
    "contrasena": "hash_3969e781e864424c",
    "autorizacion": true
  },
  {
    "id": "679fe297-323f-4840-bda1-236a926d1a96",
    "correo": "camila.rojas@utec.edu.pe",
    "contrasena": "hash_0de835a63de14d0c",
    "autorizacion": false
  },
  {
    "id": "bf8429e7-b26d-493b-af84-11aac485d8be",
    "correo": "carmen.fernandez@outlook.com",
    "contrasena": "hash_7f83d27b39a44114",
    "autorizacion": false
  },
  {
    "id": "fe7e9b69-5f9e-4088-a431-5916564b1dc9",
    "correo": "laura.sanchez@gmail.com",
    "contrasena": "hash_73cb71cd90254207",
    "autorizacion": true
  },
  {
    "id": "fffd4034-1d40-4011-8d45-f8f356a6ad38",
    "correo": "maria.garcia@utec.edu.pe",
    "contrasena": "hash_f0bb57a59716422e",
    "autorizacion": true
  },
  {
    "id": "8424088a-e93d-41f4-88cb-7017f47f0dc2",
    "correo": "magali.flores@gmail.com",
    "contrasena": "hash_97db99fb87b246a0",
    "autorizacion": false
  },
  {
    "id": "8a8a588b-f1c3-4e72-8dab-e0b5cc76e72f",
    "correo": "miguel.torres@gmail.com",
    "contrasena": "hash_f91b7a056e8f4e3b",
    "autorizacion": true
  },
  {
    "id": "3201b0ad-45f6-4970-9631-0851569c6eca",
    "correo": "valentina.ortiz@utec.edu.pe",
    "contrasena": "hash_6df9e05ee8264319",
    "autorizacion": true
  },
  {
    "id": "8126d790-601d-4db4-bb6d-9d7971098a1b",
    "correo": "roberto.diaz@gmail.com",
    "contrasena": "hash_33b27c389bab43c6",
    "autorizacion": false
  },
  {
    "id": "b6ea0f92-6250-4f2b-ab7d-31842b646f5d",
    "correo": "fernando.vega@outlook.com",
    "contrasena": "hash_9c5bf4015755488b",
    "autorizacion": true
  },
  {
    "id": "0281b583-988c-437b-ae1f-207c8dfd8654",
    "correo": "jose.gonzalez@utec.edu.pe",
    "contrasena": "hash_931bac5e88314bf1",
    "autorizacion": true
  },
  {
    "id": "a03495c9-8b2a-4c22-80ce-4a3e44299dc8",
    "correo": "diego.morales@gmail.com",
    "contrasena": "hash_44fc8f66dbaa4a0e",
    "autorizacion": false
  },
  {
    "id": "8ed8dfce-4f81-4b90-b021-38fe7b9370e0",
    "correo": "juan.perez@outlook.com",
    "contrasena": "hash_9878b7fe279b4cad",
    "autorizacion": true
  },
  {
    "id": "9eeccad3-aa30-41e8-99d2-dc26a0356afd",
    "correo": "pedro.flores@utec.edu.pe",
    "contrasena": "hash_b9ea010d858a4b05",
    "autorizacion": true
  },
  {
    "id": "01499e50-5382-4c63-b18d-06c679511872",
    "correo": "juan.perez@utec.edu.pe",
    "contrasena": "hash_15d33eff93e748db",
    "autorizacion": false
  },
  {
    "id": "f1e38222-21d7-4493-9681-2d7015ecfbb1",
    "correo": "laura.sanchez@outlook.com",
    "contrasena": "hash_d2fd2e5168be4e7f",
    "autorizacion": false
  },
  {
    "id": "cf848ac5-1d9b-4d18-8972-f0e2cc6d7fb9",
    "correo": "luis.rodriguez@utec.edu.pe",
    "contrasena": "hash_52ede320936e4695",
    "autorizacion": true
  },
  {
    "id": "8582030d-efb8-4caa-8b67-c685149253e7",
    "correo": "carmen.fernandez@utec.edu.pe",
    "contrasena": "hash_4a1209a35c1849c9",
    "autorizacion": false
  },
  {
    "id": "0e6934e3-9241-4fd6-bb68-d660039a88b0",
    "correo": "sofia.castro@outlook.com",
    "contrasena": "hash_38faf1b2d7314dae",
    "autorizacion": true
  },
  {
    "id": "d6c33f62-e640-4687-8885-149d4a4c9f70",
    "correo": "fernando.vega@gmail.com",
    "contrasena": "hash_22971aeeeb5d404f",
    "autorizacion": true
  },
  {
    "id": "0cdbdb54-61c3-4ddc-bfdd-b397f16faa76",
    "correo": "patricia.ruiz@utec.edu.pe",
    "contrasena": "hash_b78f4cbd081b4cc9",
    "autorizacion": false
  },
  {
    "id": "cc9c588a-481e-4129-abb4-c171878e7b62",
    "correo": "isabel.ramirez@gmail.com",
    "contrasena": "hash_800772881d024cdc",
    "autorizacion": false
  },
  {
    "id": "d412bff9-9a63-44a0-b7d8-aa042c58a1c1",
    "correo": "ana.martinez@utec.edu.pe",
    "contrasena": "hash_6056e2a4b2d842bd",
    "autorizacion": false
  },
  {
    "id": "a7d5b1f4-cc9a-4128-9abe-e83090c9c4e7",
    "correo": "ana.martinez@outlook.com",
    "contrasena": "hash_e85ec0c1bc174a74",
    "autorizacion": true
  },
  {
    "id": "71903b6c-2b88-4555-8b7f-5c1ad0715786",
    "correo": "carmen.fernandez@gmail.com",
    "contrasena": "hash_e943b545d9a84c00",
    "autorizacion": true
  },
  {
    "id": "b91670c0-5584-412a-bf62-23b3dfae488a",
    "correo": "patricia.ruiz@gmail.com",
    "contrasena": "hash_0b2e9db361f44e49",
    "autorizacion": false
  }
]